{
  "type": "request",
  "protocol_version": "3.0",
  "ts": "2026-09-10T17:00:00+08:00",
  "payload": {
    "req_id": "r-1",
    "op": "submit",
    "job": {
      "type": "triage.audio",
      "arguments": {
        "media": {
          "inline": "UklGRiQAAABXQVZFZm10IBAAAAABAAEAgD4AAAB9AAACABAAZGF0YQAAAAA="
        }
      },
      "priority": "interactive",
      "wait": 5
    }
  }
}
