{
  "type": "response",
  "protocol_version": "3.0",
  "ts": "2026-09-10T17:00:00+08:00",
  "payload": {
    "req_id": "r-1",
    "http_status": 202,
    "body": {
      "job_id": "mac-m1-01J7ZQ9K3W8B6Q4M2N1P5R7S9T",
      "media_ids": {},
      "type": "triage.audio",
      "status": "queued",
      "queue_position": 0
    }
  }
}
